Name,STATE,REGION NAME,POSTCODE,HOUSES & UNITS,No. of Suburbs in Postcode,New Description,Search Term,Est. Population,Current Postcode Description,Quality Checked
Bowraville,New South Wales,Country,2449,452,1,,Bowraville 2449 population,,"Bowraville is a compact town in mid north coast borderlands situated in Nambucca Valley. It's a tourist town popular for its historic museums and theatres. Beyond that, Bowraville is favourably surrounded by scenic beaches, and mountain range views as well. However, it’s a large farming town with a good number of adequate schools, childcare services, a supermarket, food shops, pubs and medical facilities. Plus, whatever amenities the residents don’t find within 2449, its proximity to Coffs harbour makes it easy to access many more parks, beaches, supermarkets, clothing stores, and schools.",
Crystal Brook,South Australia,Country,5523,450,1,,Crystal Brook 5523 population,,"Crystal Brook is one out of nine areas in 5523 under Country South Australia. It’s 184 km away from Adelaide with nearby natural geographical areas like White Cliff Hill, Mount Zion, Beetalo Reservoir, Mount Ferguson, Barn Hill and Germain Bay. Crystal Brook is situated in the Mid-North of South Australia. The town starts at the Flinders Ranges and offers sights from the Wongabirrie River to Clements Gap and Bowmans Park. You’ll also find adventurous campgrounds, adequately serviced apartments and cozy hotels to rest after a long fun day.",
Blind Bight,Victoria,Outer Country,3980,209,1,,Blind Bight 3980 population,,"Blind Bight, Tooradin, and Warneet all lie under the locality of Frankston in the state of Victoria. They are just 56 km between 3980 and Melbourne, which is an enviable distance, especially for residents who want access to more modern amenities. It boasts peaceful parks and recreational centres, clean and green neighbourhoods, walking tracks and a few swimming spots. Blind Bight is quite the laid back town, with well-spaced neighbourhoods, small acreage homes and tree-lined streets. Still, it’s a lovely coastal suburb with natural bushland,s clean air and lots of activities for kids, teens, young adults, and seniors alike.",
Boorowa,New South Wales,Country,2586,440,1,,Boorowa 2586 population,,"2586 lies under the locality of Canberra, which is 111 km away, while Sydney is 228 km far. It consists of areas like Boorowa, Frogmore, Goba Creek, Kenyu, Murringo, and Taylors Flat. Among the six are lovely historic towns, quaint little country settlements and equally tranquil localities. Reids Flat has a lovely river, tree-lined fields, vast bushlands, and scenic ponds. Murringo and Boorowa are more rural towns that feature rustic buildings, large farms, and heritage buildings. You’ll also find adventurous mazes, cherry fields, and fresh farmers' markets. However, Boorowa has a larger population with 1,641 residents to Murringo’s 365.",
Sheffield,Tasmania,Country,7306,433,1,,Sheffield 7306 population,,"Launceston is just 92 km away from 7306 with Hobart being even further, with a distance of 180 km between the two regions. Sheffield is just one out of 20 areas in 7306 and lies on the northwest coast of Tasmania. Sheffield is just 13 km southwest of Promised land, another town in 7306 that promise lovely views, a homely vibe, victorian mazes, fun theme parks and amusement parks. In Sheffield, there’s a lovely mural park that just adds a lot of colour to the already vibrant town. For marine activities, Sheffield leads residents to Lake Barrington and Devil’s Gate, which double as picnic venues, and a hub for delicious food, beer, wine and cider.",
Murrurundi,New South Wales,Outer Country,2338,431,1,,Murrurundi 2338 population,,"Ardglen, Blandford, Crawney, Green Creek, Murrundi, pages River, Sandy CreekScotts Creek and Timor are the lovely areas within 2338. It’s 72 km away from Tamworth and 238 km from Sydney. Most of the towns lie under the locality of Hunter with close proximity to Mount Temi, Lagoon Mountain, Liverpool Range, and Crawney Pass. Murrundi is one of the well-known towns in 2338, with a population of 1,028. There are many families that live in this part of 2338, however, there are even more singles and professionals in the area. Residents and visitors enjoy the scenic hiking trails, elevated lookouts, art galleries, and rustic architectural buildings.",
Berridale,New South Wales,Country,2628,430,1,,Berridale 2628 population,,"Rocky Plain, Nimmo, Paupong, Numbla Vale, Dalgety and Berridale are just some of the areas found in 2628. The region is under the locality of Canberra and is located in New South Wales. Berridale is one of the towns in 2628 with a population of 1,197. One of the first things visitors notice on their drive into Berridale is the golden-lined streets and the vibrant foliage too. Unlike other towns that attract most of their tourists in the summer, Berridale comes alive in the winter season thanks to its spectacular slopey mountains. Glide over Thredbo, Perisher or Charlotte Pass and enjoy the dynamic city views from a thrilling vantage point or cozy up in one of the mountain-side hotels and enjoy the action from the warmth of your bed.",
Tallangatta,Victoria,Outer Country,3700,423,1,,Tallangatta 3700 population,,"3700 is just 34 km away from Albury in New South Wales. It’s under the locality of Country Victoria and spans 273 km from Melbourne. Tallangatta is one of the areas in 3700 and lies at the mouth of the Mitta Arm of Lake Hume. There are many things to do in this humble yet scenic town. Residents and tourists alike could choose to take a day trip to the Tallangatta Lookout and take in the exquisite views of Lake Hume, the Sandy Creek Bridge, or the town’s centre itself. Beyond the lookout, there’s a Tallangatta Foreshorethat oversees the Lake Hume, the thrilling Sandy Creek Bridge, the elevated old Tallangatta Lookout and the Huon Reserve.",
Miners Rest,Victoria,Country,3352,419,1,,Miners Rest 3352 population,,"Addington, Brewster, Glen Park, Gong Gong, Mitchell Park, and Yendon are just six out of the numerous areas within 3352. They all lie under the locality of Country Victoria, in Ballarat, Victoria. Miners Rest is one of the northern suburbs in Ballarat with mostly residential and commercial property. It has about 3,095 residents with a young population averaging 20 to 29 years. Most families settle in the area, and since it's a fringe town of Ballarat, it’s easy to access a wide range of amenities from the neighbouring rural-urban towns. There are a good number of schools and daycare services for kids, nice parks, and shopping centres for residents to enjoy within the town as well.",
Stuarts Point,New South Wales,Country,2441,413,1,,Stuarts Point 2441 population,,"Stuarts Point is one of the most popular towns in 2441. It sits close to Coff harbour and is about 378 km away from Sydney. You’ll find lovely geographical locations like Grassy Head, Shark Island, Trial Bay, and South West Rocks close by to this lovely holiday town. With a sparse population of 770 people, the area boasts property ownership of 65%. Mostly families settle in the area, and they enjoy rustic homes, more modern variations, and a fair amount of acreage depending on the neighbourhood. Visitors also love 2441 because of the natural attractions from beaches, to the national parks, and wetlands, as well as the lovely mountain views.",
Middleton,South Australia,Country,5213,408,1,,Middleton 5213 population,,"Middleton lies within 63 km of Adelaide, the capital of South Australia. It’s equally proximate to McFarlen hill, Commodore Point, Pullen Island, Frenchman Rock and Victor harbour. It’s the only area within 5213, yet has a lot to offer in terms of communal living, proximity to the central area, and basic amenities. Additionally, it has a population of 1,156and sits between the towns of Goolwa and Port Elliot. The small town is largely known for its tranquil beaches and lovely marine activities. Yet, it’s fast becoming a blooming hamlet full of bakeries, holiday homes, gift shops and bed and breakfast outlets.",
Yarragon,Victoria,Outer Country,3823,404,1,,Yarragon 3823 population,,"The areas in 3823 have dynamic neighbourhoods, different landscapes, and various activities to offer. Yarragon South is blessed with lovely natural sites like Mount Worth State Park and Uralla Nature Reserve. It lies by Princes Highway close to Warragul and Moe. The 169 residents in the town are mostly made up of families, and they enjoy widely spaced neighbourhoods and rolling green fields. Yarragon is more residential with boutique shops, antique stores, and arts and crafts shops lined through the streets, it has a larger population of 1,650 with lots of cafes, restaurants and bakeries to service that number.",
Riverton,South Australia,Country,5412,400,1,,Riverton 5412 population,,"Major highways, catholic heritage cemeteries, historic railway stations, and caravan parks are some of the highlights of 5412. The entire region is situated in Adelaide, South Australia. With popular neighbouring geographical locations like Kapunda Reservoir, Mount Allen, Smith Hill, Mount Oakden and Pinkertons Plains. Riverton is a small town in Gilbert Valley, popular for its historic stone cottage, museums, blacksmith shops and caravan park. It has lovely venues with rich agricultural history, with rustic buildings showing proof of some of the early architectural designs. Just like most of the towns and localities in 5412, it boasts peaceful neighbourhoods, vast virgin lands, and rolling green fields that deliver the optimal country vibe.",
Milton,New South Wales,Country,2538,400,1,,Milton 2538 population,,"From rustic villages to small highway towns, 2538 offers a lot in terms of diverse landscapes, beautiful national parks and scenic natural attractions. The areas in 2538 lie under the locality of New Country West and are about 39 km away from Nowra. Travelling to Sydney would take about 3 hours and 30 minutes, however, there’s a lot to within 2538 itself. Morton, for example, is a lovely rural location situated in Illawarait that has a lovely national park and scenic beaches that offer lovely sunset views. Visitors come from near and far to see the picturesque Fitzeroy Falls firsthand, as well as Belmore Falls, Lake Yarrunga, and the Grand Canyon Lookout.",
Kendall,New South Wales,Country,2439,400,1,,Kendall 2439 population,,"Batar Creek, Logans Crossing, Lorne, Kew and Rosslen are just some of the areas within 2439. The historical towns boast lovely landscapes, clean country neighbourhoods, tranquil parks, as well lovely walking paths. Kendall, one of the towns in 2439, is a mid-north coast suburb in New South Wales. It promises so many natural and side attractions from the Camden Haven River and the Green Comboyne Plateau. Its proximity to the hinterland gives residents access to Middle Brother and Coorabakh National Park. a stroll through the town would reveal lovely historical tidbits, from the famous quotes of henry Kendall to his actual statue at the corner of Comboyne street.",
Gin Gin,Queensland,Country,4671,399,1,,Gin Gin 4671 population,,"4671 has up to 36 areas from Boolboonda, Bullyard, Damascus, Lake Monduran, Mount perry, and Wallaville, to Redhill Farms. The entire area sits 62 km near Bundaberg and 297 km away from Brisbane. Gin Gin is one of the popular rural towns in the region, and it also doubles as one of the most scenic historical areas in 4671. It’s home to about 3000 people and features wide streets, lovely road networks with central gardens, roadside food outlets, service shops and restaurants. Additionally, Gin Gin has on display lovely landscapes with large-streched vineyards, farms, and sugar cane fields. This calm and picturesque town is a perfect place to settle in with family, start a new life, or visit on the holidays.",
Kurmond,New South Wales,Extended Metro,2757,396,1,,Kurmond 2757 population,,"Richmond is the nearest urban centre to 2757, with Sydney being about 57 km away. Both regions are enviably close to Kurmond, the only area in 2757. Kurmond is under the locality of Penrith, New South Wales. It has a population of 859 people with an average age of 40 to 59. Most of the residents have large families, even though professionals, singles, and retirees also live in the region. Additionally, about 85% of the residents live in their own homes, thanks to the relatively decent real estate prices. Plus, the neighbourhoods and clean and green, there are lovely parks and recreational centres to play and unwind at, as well as scenic city and mountain views to soak in.",
Maslin Beach,South Australia,Regional,5170,380,1,,Maslin Beach 5170 population,,"Ochre Point, Gull Rock, Onkaparinga Head, Delabole Hill, and Sellick Beach are just some of the lovely geographical areas surrounding the 5170 regions. They are easy to locate from Maslin Beach, the only town in 5170, which also has some hidden gems of its own. The southern coastal suburb lies just 36 km away from Adelaide. It boasts pristine beaches, offers lovely tours, and has some of the most colourful wineries and beer farms. With a population of 1,152 people, 5170 is still a bit sparsely populated, yet that just means it has so much space for visitors, and the lovely greenery, forests, and walking tracks that make country towns so sought after.",
The Rock,New South Wales,Country,2655,380,1,,The Rock 2655 population,,"Birdlip, French Park, the Rock, Kubura, and Tootool are all areas within 2655. They lie under the locality of Canberra and are only 33 km away from Wagga Wagga. Sydney sits a bit further with 410 km separating the two regions. While Birdlip, French Park, and Tootool are all rural settlements, The Rock is the only suburb within 2655. With a population of 1,236, the town is well-organized with clean and green neighbourhoods, parks and recreational centres. Plus, it’s a scenic character town with lovely farms, heritage buildings, historic memorial stands, and picnic benches. One of the best places to visit is the Rock Hill Nature Reserve which boasts a vast variety of flora and fauna.",
Wattle Glen,Victoria,Extended Metro,3096,259,1,,Wattle Glen 3096 population,,"Wattle Glen is the only area within 3096 and lies under the locality of Preston. It’s enviably close to Melbourne, with just 26 km between 3096 and Victoria’s capital. The cozy and vibrant suburb of Wattle Glen has a growing population of 1,961 with 94% of the residents living in or owning personal properties. Additionally, there are more families in this suburb, with just one major primary school in the area. However, there are more standard schools surrounding this quiet little suburb, as well as other modern amenities. The homes have decent acreage, are situated in quiet neighbourhoods and are only minutes from train stations, walking trails and more modern amenities.",
Dayboro,Queensland,Outer Country,4521,370,1,,Dayboro 4521 population,,"Campbell’s Pocket, King Scrub, Ocean View, Mount Pleasant, and Dayboro are just some of the areas within 4521. The entire region lies under the Northgate Region and is only 41 km away from Brisbane, Queenslands’ capital. Dayboro is a rural town with a populace of 2,126 residents. It’s part of the Moreton Bay Region and boasts lovely mountain views and modern amenities across the town. You’ll find standard medical services, excellent bakeries, good schools, various restaurant choices and a warm and welcoming community. Residents and visitors mostly spend their days touring through the antique shops, enjoying warm snacks books and gifts in the homely cafes, and the tourist information centre.",
Yandina,Queensland,Regional,4561,370,1,,Yandina 4561 population,,"The coastal towns of 4561 lie under the locality of Mount Isa, with well-known geographical features like Fair Hill, Mount Combe, Mount Wappa, Swain Peak, Lake Weyba and Point Glorious. Rural towns like Ninderry, North Arm, and Yandina have some of the loveliest sights in 4561. There’s the Ninderry mountain, a botanical garden and walking tracks in Niderry, scenic rolling green fields, poultry parks in North Arm and recreational centres with fun ride exhibits and rainforest in Yandina. You’ll also find a historical house, an observatory, and a memorial park within Yandina.",
Avoca,Victoria,Outer Country,3467,214,1,,Avoca 3467 population,,"Avoca and Moyreisk both lie under Country Victoria and are situated 75 km away from Ballarat. These 3467 towns have populations of 1,194 and 24 for Avoca and Moyreisk respectively. Avoca is largely a charming country town with lovely vineyards, green rolling fields and thick bushes. It boasts over 25 wineries, this is an excellent town to go winetasting. Plus, there are lovely bakeries to peruse, rustic restaurants, antique shops, wine estates and fine cottages. Avoca also has a railway station that carries residents and visitors to and from the town, as well as an adequate transport system that does the same.",
Dunedoo,New South Wales,Outer Country,2844,363,1,,Dunedoo 2844 population,,"Birriwa, Cobbora, Dunedoo and Leadville are the only major areas in 2844. They are under the locality of New Country West. Dubbo is just 74 km away with Sydney about 267 km far. Plus, 2844 majorly consists of localities, villages, and just one town. Dunedoo is a scenic village with the most inhabitants across 2844. It’s located by Castlereagh Highway in the centre of New South Wales. There are lovely local restaurants, decent accommodation options, cafes, country pubs, and antique stores. For tourists looking for memorable adventures and a generally exciting trip, head to the National Park, the zoo or some of the wine estates across town.",
Wahgunyah,Victoria,Country,3687,361,1,,Wahgunyah 3687 population,,"Wahgunyah is the only area within 3687 and is located in northeastern Victoria by the southern bank of the Murray River. It’s about 51 km away from Albury and 239 km far from Melbourne. It’s a lovely country town with clear roads, clean neighbourhoods, and a lovely combo of modern and rustic homes and buildings. 3687 is mostly known for its wine estates, vast vineyards, and heritage style buildings that just make Wahgunyah look regal. Some of the fun things people come to do in 3687 are fishing waterskiing, canoeing, and rowing on the Murray River. There are also lovely walking tracks that extend to the inner city from various points of the river bank.",
Bunyip,Victoria,Outer Country,3815,356,1,,Bunyip 3815 population,,"The leafy towns and localities of 3815 are located in Melbourne, Victoria, under the locality of Country Victoria. Bunyip, Bunyip North, Iona and Tonimbuk all have lovely sceneries, green fields, thick forests, and for some, historical and rustic landscapes. Tonimbuk, which is just home to 208 residents is largely residential with decently sized buildings, and extensive forestry. It has walking and cycling trails on the route to Mount Cannibal, wildlife at the state park, country homesteads and adventurous retreats. Iona, on the other hand, is more residential, with rustic homes, heritage buildings and vast farmlands.",
Baranduda,Victoria,Country,3691,352,1,,Baranduda 3691 population,,"3691 has about 31 areas in it, with Baranduda, Allans Flat, Bellbridge, Edbthe Ebden, Castle Creek and Kancoona as some examples. The area is just 37 km away from Albury, with Melbourne about 260 km far. Allans Flat is one of the popular destination towns within 3691 and boasts lovely reserves, swimming holes and picnic locations for residents. It’s home to just 318 people, yet offers a lot of family fishing activities. Even more popular and largely visited is Huon Creek, which is supposed to be a small rural location, yet has luxury retreats, exquisite accommodation, and scenic views to capture from the homestead to the country rail trail.",
Islington,New South Wales,Regional,2296,350,1,,Islington 2296 population,,"Islington is a lovely suburb located in the city of Newcastle. It’s the only area in 2296 and lies under the Hunter Region of New South Wales. Plus, it’s quite close to Newcastle’s central business district and provides easy access to Sydney. With a population of 1,883, this friendly town may just be the perfect escape from the hustle and bustle of the city, regardless of how close it is to such urban areas. There are a lot of heritage buildings, and a lot of them are being renovated to suit the modern needs of the residents and potential occupants. Furthermore, there are a good number of amenities including medical facilities, parks, and schools, plus, it’s close to major beaches, universities, and shopping complexes.",
Mallala,South Australia,Country,5502,348,1,,Mallala 5502 population,,"Grace Plains, Korunye, Mallala, Redbanks, and Reeves Plains all belong under 5502. Situated just 53 km away from Adelaide, the region has the vantage of proximate amenities, private schools, medical services, and more diverse dining and recreational options. Grace Plains, Korunye, Mallala and Reeves Plains are all largely rural settlements, but Redbanks is more developed and has a larger population. It’s situated in the lower mid-north of South Australia very close to Light River. Even though it’s really close to the State’s capital, there are still some vast untouched areas in 5502. Plus, you’ll still find old-looking or standard building types which just differentiates true country regions like these from the extremely developed cities and urban regions.",
Kambalda,Western Australia,Country,6442,348,1,,Kambalda 6442 population,,"6442 is under the locality of Koolgoorlie in Western Australia. It’s close to Red Hill, Mount Goddard, Lake Lefroy and Parker Hill. Kambalda is the only area within 6442, yet still offers a good number of benefits and side attractions to residents and visitors alike. It’s a lovely historical town known for its farming and agriculture. Still, it has express views of Lake Lefroy and adequate highlights to Red Hill Lookout. With a population of 2,539, this homely town offers cool working opportunities, adequate amenities, and of course, lovely sights and adventures. There are a good number of schools, childcare services, parks, swimming pools and lovely picnic spots.",
Dry Creek,South Australia,Metropolitan,5094,85,2,,Dry Creek 5094 population,,"Cavan, Dry Creek and Gepps Cross are the three areas within 5094. Cavan is largely a residential area, with about 40 people living in the town, but it also has some industrial establishments situated in the area. Dry Creek, another residential suburb in 5094, is also largely industrial, There are a good number of corporations, depots and warehouses and railway stations. Even more, Dry Creek boasts some wetland pockets across the town, encouraging lovely flora and fauna to grow and settle in those habitats. Plus, they have one of the most spectacular mangrove habitats across the globe, with vast reeds and samphire beds plus an extensive bird and fish population.",
Gepps Cross,South Australia,Metropolitan,5094,261,2,,Gepps Cross 5094 population,,"Cavan, Dry Creek and Gepps Cross are the three areas within 5094. Cavan is largely a residential area, with about 40 people living in the town, but it also has some industrial establishments situated in the area. Dry Creek, another residential suburb in 5094, is also largely industrial, There are a good number of corporations, depots and warehouses and railway stations. Even more, Dry Creek boasts some wetland pockets across the town, encouraging lovely flora and fauna to grow and settle in those habitats. Plus, they have one of the most spectacular mangrove habitats across the globe, with vast reeds and samphire beds plus an extensive bird and fish population.",
Round Corner,New South Wales,Metropolitan,2158,345,1,,Round Corner 2158 population,,"2158 is enviably close to Sydney, with just 26 km keeping the two areas apart. Plus, it consists of three towns; Dural, Middle Dural and Round Corner. Dural is a lovely semi-rural community that delivers the practical country feel and ambience from the very first signpost to the last road. You’ll find roadside fruit and veggie stalls, local markets, and some rustic, yet well-maintained building in most of the neighbourhoods. There’s an array of schools to choose from, both situated in and around 2158. Even more, there are lovely parks, libraries, sporting facilities, and medical facilities.",
Nathan,Queensland,Metropolitan,4111,337,1,,Nathan 4111 population,,"The 4111 postcode is home to the grand public research university of Griffith. Established in 1975, this prestigious university has been home to quite a number of students, academic and non-academic staff. The Nathan suburb also falls within the 4111 postcodes and has a population of 1,183 residents. It’s located in the city of Brisbane, Queensland with natural attractions like Mount Gravatt, Hamilton Reach and Half Moon Lagoon nearby. Regardless of its proximity to the bustling city of Brisbane, the neighbourhoods are quite peaceful, green, and clean. The Toohey Forest surrounds the town forming a lovely backdrop ambience, but even more, the green shrubs, thick forests and rolling fields keep that wholesome country feel in 4111.",
