Riddells Creek,Victoria,Country,3431,171,1,,Riddells Creek 3431 population,,"Just 15 km off of Sunbury, Victoria lies the lovely Riddels Creek town, which i the only area in 3431. It’s enviably close to natural hot spots like Mount Macedon, Melton Reservoir, Whittlesea, Quarry Hill and Treasury Gardens. It’s seated by the Macedon Ranges, which gives it the leverage of lovely homes, restaurants, hotels or park views. With about 3,167 people, this historic town promises tranquil neighbourhoods, relaxing accommodation options, and the lovely blend of a rustic village town and modern amenities. It’s equipped with schools, adequate transport systems, and medical and fitness facilities",
Biggenden,Queensland,Outer Country,4621,332,1,,Biggenden 4621 population,,"4621 is 81 km away from Bundaberg, which is the closest urban city to the region. However, it’s even further from Brisbane, with 236 km separating the two areas. Still, it boasts about 11 multi-dynamic areas from Biggenden to Woowoonga. Biggenden is a rural town in the North Burnett region in Queensland. It may be a small town with just 845 residents, however, there are a lot of natural attractions to explore in this 4621 suburb. There are the lovely ranges of Mount Walsh, which practically act as the backdrop of the town. Plus, the spectacular Chowey Bridge, with just one other like it in the whole of Australia. For even more fun, head north and explore the beautiful art trails or be adventurous and visit the Mount Walsh Nationa Park, soak in the lovely delights, swim in the pool pockets, or climb to the rocky peaks and literally feel on top of the world.",
West Burleigh,Queensland,Regional,4219,330,1,,West Burleigh 4219 population,,"West Burleigh is the only country town represented by the 4219 postcode. It lies 12 km away from Gold Coast, Queensland and only 82 km away from the capital city- Brisbane. With a fast-developing landscape, 4219 has biome a hot spot for real estate developers. Boasting clean and green neighbourhoods, good road networks, standard schools and lovely restaurants, West Burleigh is certainly one of the country towns to visit or live in as a commuter or resettler. Its proximity to Gold Coast and Brisbane makes it fairly easy for residents to travel in and out of time as they will. Lovely shopping hubs, standard private schools, scenic beaches, and trendy cafes are just some of the amenities ist 10,077 residents enjoy.",
Rylstone,New South Wales,Country,2849,327,1,,Rylstone 2849 population,,"2849 has up to 29 areas within its borders, with Bathurst about 94 km away. It’s categorised by lovely mountains, scenic creeks, and calm rivers. Plus, it’s surrounded by popular places like Nullo Mountain, Mount Brace, Cox’s Crown, and Eaglehawk Rock. One popular area within 2849 is Rylstone which has a growing population of 926 residents. The average age in this town is 60 plus, yet that doesn’t mean there aren’t a good number of activities suitable for all ages. Although it’s a widely rustic small town with lovely old and heritage buildings, you’ll still find adequate restaurants serving up tasteful local and continental dishes, wineries, teahouses, and boutique shops.",
Yankalilla,South Australia,Country,5203,325,1,,Yankalilla 5203 population,,"Bald Hills, Parawa, Torrens Vale, Tunkalilla, Wattle Flat, and Yankalilla are the prestigious areas within 5203. Situated about 70 km away from Adelaide, these towns and localities promise serene environments, fresh country air, minimal traffic and lovely rest stops and hotels. Bald Hills lies on the eastern coast of the Gulf of St. Vincent. It’s a scenic town that features lovely rolling green fields, rich olive groves, and thrilling water activities. Torrens Vale is another country town that has lovely views, yet quite a small population of 59 people. It mostly consists of families, with most of the residents living in their own homes.",
Berrinba,Queensland,Extended Metro,4117,321,1,,Berrinba 4117 population,,"Berrinba and Karawatha are the only areas within the 4117 postcode. The area is surrounded by lovely and well-known natural attractions like Half Moon Lagoon, Duck Island, Mount Thompson, Pine Mountain, and Whites Hill. there’s a functional train station just 1.5 km from Berrinba and Karathwa, plus, the Brisbane International Airport is just 28 km away. Berrinba happens to be a quiet, green suburb with 1,345 residents. It has a lovely, tight-knit community, nice parks and recreational centres, and safe walking tracks. Berrinba also boasts affordable housing and decently sized homes, it’s no wonder most of the residents own properties in the town. Karathawais a smaller town that’s sparsely populated. It’s the perfect getaway town for country lovers or families that want to move away from the noise and vast advancements of the city.",
Edinburgh Residential Village,South Australia,Metropolitan,5121,50,2,,Edinburgh Residential Village 5121 population,,"Tucked away in Adelaide, South Australia are the lovely northern suburbs in 5121. Macdonald Park, Penfield, and Penfield Gardens are favourably situated in the urban fringe of Adelaide. They all feature a good mix of modern homes, rustic buildings, and a community that’s open to practically anyone. Even though it’s 28 km away from Adelaide, the area is still developing, and you’ll find laid back neighbourhoods, peaceful parks, and generously spaced homes. There are a good number of parks surrounding the neighbourhoods, as well as open spaces to relax, and well-landscaped areas that look absolutely lovely on camera.",
Penfield,South Australia,Metropolitan,5121,270,2,,Penfield 5121 population,,"Tucked away in Adelaide, South Australia are the lovely northern suburbs in 5121. Macdonald Park, Penfield, and Penfield Gardens are favourably situated in the urban fringe of Adelaide. They all feature a good mix of modern homes, rustic buildings, and a community that’s open to practically anyone. Even though it’s 28 km away from Adelaide, the area is still developing, and you’ll find laid back neighbourhoods, peaceful parks, and generously spaced homes. There are a good number of parks surrounding the neighbourhoods, as well as open spaces to relax, and well-landscaped areas that look absolutely lovely on camera.",
Upper Beaconsfield,Victoria,Extended Metro,3808,310,1,,Upper Beaconsfield 3808 population,,"3808 lies under the locality of Frankston in Melbourne, Victoria. It’s close to popular geographical areas like Caversham, Beaconsfield Reservoir, Bald Hill, Sherbrook Falls, and Sugarloaf Hill. 3808 may just have two regions, however, there’s still a lot to see in the quaint little towns of Beaconsfield Upper and Dewhurst. Beaconsfield Upper lies about 45 km away from Melbourne and has a populace of 2,861. The average age in the region is 40 to 59, while homeownership stands at 95%, with only 5% of the homes occupied as rentals. The town is also largely populated by families and boasts clean and green neighbourhoods, lovely parks and recreational parks enjoyed by all ages.",
Eudunda,South Australia,Country,5374,300,1,,Eudunda 5374 population,,"There are up to 15 areas within 5374, with popular nearby locations like Mount Rufus, Smith Hill, The Bluff, Mount Allen, and Lake Short surrounding the area. It’s not the closest region to the state’s capital, still, an hour and thirty minutes should get you from 5374 to Adelaide. Eudunda is one of the most popular areas in 5374 with a population of 823 residents. There’s practically an equal amount of families and singles in the area, with up to 80% of them living on their own properties. Its German heritage is obvious through its cuisine, cafes and local restaurants and cottages. Even more, there are lovely walking trails to explore, horse equestrians, and the scenic mount lofty ranges to tour when in 5374.",
Carisbrook,Victoria,Outer Country,3464,300,1,,Carisbrook 3464 population,,"3664 has just one area within its borders, Avenel. The quaint little town lies under the locality of Country Victoria and is about 62 km away from Shepparton, which happens to be the closest urban area to 3664. There’s a cool mix of modern residential buildings and more rustic home designs across various neighbourhoods. Plus, with a population of 1,039, more than 80% of the residents live in their own homes. Additionally, the town is made up of more families, which explains the number of childcare services and schools in 3664. Even more, there are fun places to tour when in Avenel, from the lovely wineries, the Hughes Creek heritage bridge, wine estates and Avenel Maze.",
Inglewood,Victoria,Outer Country,3517,298,1,,Inglewood 3517 population,,"The nearest urban centre to 3517 is Bendigo, which is just 52 km away. The region consists of about 12 main areas, including Brennan, Bullabul, Inglewood, Kingower, and Serpentine. Beyond 3517, there are other popular natural attractions like Mount Korong, Lake Boort, Ninety Mile Desert and Woolshed Swamp. This makes it a lovely region to visit or live in, cause there’s a lot to do within the towns, and some short miles around the 3517 zone. Towns like Inglewood offer tranquil walking trails, antique shops, cafes, museums, adventurous caves at the Kooyoora State Park and calm rivers for fishing trips and other marine activities.",
Cressy,Tasmania,Country,7302,292,1,,Cressy 7302 population,,"Rolling green fields, scenic rivers, colourful flora and thick bushlands are just some of the features to soak in around the 7302 regions. The entire area is just 36 km away from Launceston and consists of Bracknell, Cressy, and Poatina. Bracknell is a rural community with lovely greenery and extensive lands, but a sparse population of 459. It’s a largely residential and agricultural community that depends largely on servicing the local produce needs within and outside its borders. Cressy, is a more modern town, with a growing community of 1,111 residents. It’s home to Brady’s lookout, a fly fishing museum, and a conservation area. Poatina has a smaller population of 96 people, yet has some lovely side attractions from classy hotels, to lovely theme parks, and performing arts facilities.",
Tingha,New South Wales,Country,2369,291,1,,Tingha 2369 population,,"2369 is home to three prestigious areas within New South Wales; Old Mill, Stannifer, and Tingha. The towns and villages within 2369 all boast lovely heritage buildings, natural attractions, and some historical views and monuments preserved by the county. In Tingha, there’s a lovely honey farm where people stop to purchase the golden liquid, a green valley farm with playgrounds for kids, waterslides, an exotic zoo, BBQ facilities and a historical museum. About 5 km beyond this activity hub lies the Moredun Pond, blessed with marine life from cods to Silver Perchs'.",
Elmore,Victoria,Outer Country,3558,290,1,,Elmore 3558 population,,"3558 stands 149 km away from the capital city of Victoria and is under the locality of Country Victoria. It has up to five areas within its borders, Burnewang, Corop West, Elmore, Hunter and Creek View. Burnewang is a lovely historic area consisting of majestic heritage properties, some homes, and serviced apartments as well. Elmore, on the other hand, while still sparsely populated, boasts more major amenities, and has proven to be a great roadside stop town to unwind, relax, play and just enjoy the serene environment. There are some playgrounds, parks, lovely gift shops, cafes, a heritage Catholic Church, and a thrilling miniature railway station for the kids to play.",
Samford Village,Queensland,Country,4520,290,1,,Samford Village 4520 population,,"Camp Mountain, Cedar Creek, Closeburn, Draper, Highvale, and Mount Glorious are just some of the areas within 4520. The region is just 24 km away from Brisbane, and 28 km from the Brisbane International Airport. One of the most popular suburbs within 4520 is Samford Valley, home to 3,068 people. It’s a lovely town to escape to, especially for the country feel, generous parking spaces and minimal traffic. Even more, the rolling green fields, beautiful rainforests and vibrant art community make it a hot spot for families, professionals, singles, and any country lover looking to unwind. Plus, there are many serviced apartments with excellent elevated views of colourful foliage, vineyards, and nearby hills. There are also lovely wildlife sanctuaries, museums, and accommodation options sitting by the popular Mount Glorious.",
Church Point,New South Wales,Metropolitan,2105,158,1,,Church Point 2105 population,,"2105 holds thrilling mysteries within its borders that kids, teens, and adults alike will love. It consists of Church Point, Elvina Bay, Lovett Bay, and Scotland Island, which is only accessible by water. The Island doubles as a suburb by the northern beaches of Sydney, with Church Point being its main service area, and the gateway to this lovely marine paradise. With just about 1 km diameter worth of land, there are two major playgrounds, a scenic water-side walking trail, and some lovely cabins to peruse. However, the island is not an amenity-rich area, so planning an entire vacation in it may become slightly limiting after a while. Church Point, on the other hand, is a seaside suburb, with up to 997 residents. It’s more modern, boasts a wider range of amenities, and has transport links to a good number of small settlements around the western part of Ku-ring-gai Chase National Park.",
Woodburn,New South Wales,Country,2472,280,1,,Woodburn 2472 population,,"2427 is not the closest region to New South Wales's capital city, Sydney. However, it is just 40 km away from Lismore, 39 km away from the Lismore Airport and 36 km away from Banyabba train station. It consists of Broadwater, Buckendoon, Kilgin, New Italy, Rileys Hill, Tabbimoble and Woodburn. While there are many natural attractions in 2472, New Italy is an interesting village that gives residents and visitors alike a little slice of the Italian culture. Even more, the European ambience, tasteful coffee, lovely cafes, and the Italian museum are just some of the things that have people stopping by more than often. Broadwater, yet another river town in 2427, is home to 642 residents but has lovely town views and natural attractions like the Evans River, Broadwater National Park and Broadwater Beach.",
Edmondson Park,New South Wales,Metropolitan,2174,271,1,,Edmondson Park 2174 population,,"The 2174 postcode is only 34 km away from Sydney, in New South Wales. It consists of Edmondson Park and Ingleburn Milpo, and they are both under the Campbelltown locality. With a population of 2,271, the suburb of Edmondson Park is still a bit sparse for a town that’s this close to Sydney. It boasts quite a young population, with the average age in the area being 20 to 39. Furthermore, up to 76% of the residents live in their own homes, even though most of the people here are young families and professionals. Still, the allure of the town is in its peaceful sceneries, lovely parks, proximity to shopping areas, and adequate transports systems.",
Canungra,Queensland,Outer Country,4275,270,1,,Canungra 4275 population,,"Canungra is a country town located in the lovely Rim Region of Brisbane, Queensland. It’s one of the many areas within 4275 with a population of 1,237 and an average age of 40 to 59. Mostly families, professionals, retirees and indigenes live here, however, the number of single in the Canungra surpasses the number of families. Beyond that, this quaint little town bridged at the foothills of Lamington National Park is just 40 minutes from the Gold Coast. It’s a vibrant town with budding local businesses sprawled on each side of the streets, and rustic neigbourhoods largely surrounded by thick green foliage. However, the entire 4275, including Canungra are more popular for their blossoming farmlands, vineyards, wineries, and contemporary equine facilities.",
Ulmarra,New South Wales,Country,2462,262,1,,Ulmarra 2462 population,,"2462 is not the closest region to Sydney, yet, it’s quite proximate to Coffs Harbour in New South Wales. It has up to 12 areas within its borders, with Calliope, Coldstream, Lavadia, and Ulmarra making up just four out of that number. The entire 2462 is surrounded by popular natural attractions like Lake Minnie Water, Mount Elaine, Clarence Peak and Sandon Bluffs. Ulmarra is one popular country town within 2462 with a population of 772 people. It has more of an elderly population and just one public school in the area. Additionally, it’s rich in arts and crafts, culture, local cuisines, and history.",
Pt Wakefield,South Australia,Country,5550,250,1,,Pt Wakefield 5550 population,,"Localities like Kallora, Bowmans, Beaufort, and South Hummocks are all largely residential areas in Adelaide, South Australia. It’s surrounded by Port Author, Damond Lake, Mount Templeton, and Mangrove Point. However, within the country town of Port Wakefield, there’s much to discover. Most already associate this part of 5550 as the traveller's highway town near Highway One. There are many roadside rest stops, shops, and refreshment centres that serve weary travellers on their way through this simple yet scenic coastal town. However, in the central area of Port Wakefield, you’ll find poultry farms, quarry mines, transportation hubs, and developing residential areas. Even more, there are marine activity sand walking trails to enjoy around Gulf St Vicent and Clinton National Park.",
Yanco,New South Wales,Country,2703,246,1,,Yanco 2703 population,,"Yanco is the only area within 2703, and it belongs under the Canberra locality in Sydney, New South Wales. The nearest urban region to 2703 is the vibrant historic city of Wagga Wagga with just 103 km separating it from 2703. The colourful village of Yanco has a spares population of 973. It boasts quite a young population, with many families with kids resident in the town. Still, the percentage of singles beat the number of families by a 36% margin. There are a good number of childcare services, and schools available in the area. Even more, most residents settle here because of the decent cost of living, real estate deals, and the large acreage homes 2703 promises.",
Geeveston,Tasmania,Country,7116,237,1,,Geeveston 7116 population,,"7116 has up to eight areas within its borders, with Geeveston being one of the most popular. It’s about 45 km away from Hobart and lies on the Huon River. This administrative town is by far the furthest from the State’s capital, but still has so many things to offer in terms of cuisine, natural attractions, and communal living. 7116 prides itself in its vast farmlands, and Geeveston is not left out, they have lovely apple trees, large forests, and scenic rolling hillsflowing into the Hartz Mountains National Park. Included in the lavish activities to be enjoyed in the area, residents could choose to dip in the thermal springs pool at Hastings Cave or enjoy the tranquil rest stops generously stationed by the waterside.",
Stanley,Tasmania,Country,7331,236,1,,Stanley 7331 population,,"Tasmania is home to the Stanley, the only are in 7331. It’s 173 km away from Launceston, and even further away from Hobart, Tasmania’s capital. This romantic and scenic area sits on a slim shaving of land by Tasmania’s northwest coast. One of the most memorable features of 7331 would have to be the large volcanic plug that extends from the waters at the edge of the town. Furthermore, Stanley is a quaint town with a rich history and culture, however, some of the activities like fishing have largely reduced over the years. The area is now majorly known for its spectacular geographic features, the heightened chairlift, heritage walks and tasteful local cuisines.",
Morgan,South Australia,Country,5320,230,1,,Morgan 5320 population,,"Country South Australia is home to the areas within 5320. It’s about 125 km away from Adelaide, yet situated around the right bank of the Murray River. Bundey, Morgan, and Murbko are the only areas in 5320. Two of them are localities featuring large landscapes, largely residential areas and vast untouched lands. Morgan is the only country town in 5320, with a population of 426 residents. It’s a lovely rustic town suitable for families with kids, retirees, and young professionals looking for a quiet place to conduct their business. Some of the major areas to visit in 5320 are the Riverfront reserve, Morgan’s Historic Wharf, the historical museums and conservation parks.",
Ashford,New South Wales,Country,2361,219,1,,Ashford 2361 population,,"Ashford, Atholwood, Bonshaw, Limestone and Pindarol are all areas within 2361. You’ll find lovely national parks, scenic rocky hills and limestone caves in the locality of Ashford, and residential areas, farms and a public school in Bonshaw. The compact village of Ashford sits northwest of the northern tablelands in New South Wales. It’s a really quiet settlement with well-spaced homes, tranquil streets and scenic natural attractions. You can visit the lovely Kwiambal National Park, peruse the limestone caves and soak in the sights at the Macintyre Falls.",
Sassafras,Victoria,Extended Metro,3787,213,1,,Sassafras 3787 population,,"Peaceful neighbourhoods, towering hills, vibrant foliage, extensive national parks, and a cool mix of rustic and modern houses. Those are just some of the things you should expect when visiting the comfortable town of Sassafras. It’s one of the two areas within 3787, and lies about 34 km away from Melbourne, with the popular Mt. Dandenong in view. It’s a lovely place to visit, unwind, rejuvenate and generally feel at home in. The tea shops, cozy cafes, creek reserves, national parks, local cuisine and botanical gardens all give residents and visitors alike a feel-good vibe, especially when coming from a busier and more bustling town.",
Eagle Heights,Queensland,Outer Country,4271,208,1,,Eagle Heights 4271 population,,"Gold Coast and Brisbane lie enviably close to the 4271 postcodes in Brisbane, Queensland. The area is largely residential, with most of the other lands used for farming as well. Eagle Heights, the only area within 4271 is enviably close to popular natural attractions like Hendersons Knob, Wonga Wallan Mountain, Birnam Range and Oyster Lake. Plus, it has lovely mountain view reserves offering luxury amenities and a welcoming stay at 4271. The scenic rainforest, picture-perfect natural bridge at Mt. Tambourine and luxury resorts are all lovely areas suitable for pre-wedding shoots, excursions, sightseeing, wedding receptions, and classy birthday parties.",
Laura,South Australia,Country,5480,200,1,,Laura 5480 population,,"5480 is home to Appila, Laura and Stone Hut, all under the locality of Country South Australia. The areas are mostly residential, yet all of them are sparsely populated. However, the views in this area make it an allure to most visitors, resettlers and residents alike. Stone Hut is a little locality within 5480 with just 24 residents. Yet, there’s a lovely petting zoo, hut bakery, and historical trail for residents all to enjoy. Laura, on the other hand, has a larger population of 570 residents and is slightly more vibrant. You’ll also find historical monuments, marine reservoirs, cycling trails and a courthouse gallery for easy perusal.",
Olinda,Victoria,Extended Metro,3788,197,1,,Olinda 3788 population,,"Olinda is under the Ferntree Gully locality, and also happens to be the only area within 3788. The town is about 37 km close to Melbourne and has Olinda Falls, Barnes Lookout, Dandenong Ranges, Sherbrook Falls, and Mount Morton in close reach as well. This sparsely populated town with 1,738 residents still manages to maintain that country vibe, regardless of it’s proximity to the state’s capital itself. You’ll find cozy cottages, rustic houses, really quiet neigbourhoods, and minimal traffic in the tranquil region of 3788. But most importantly, Olinda is one of the most picture-perfect destinations suitable for newlyweds, large families, old couples, and any country-loving, adventure-seeking individual that loves to soak in nature at every chance.",
Kallista,Victoria,Extended Metro,3791,193,1,,Kallista 3791 population,,"3791 is one of those areas that are favourably close to Melbourne. With just one town within its borders, the area it’s surrounded by mountain forests, lovely ranges, and a population of 1,437 people. Kallista, the quaint little tourist locality is proximate to some really popular natural attractions like the Silvan Reservoir, Dandenong Ranges, One Tree Hill, Sugarloaf Mount, and Olinda Falls. The village itself is seated between Olinda and Belgrave with extensive virgin lands, rolling green fields, and some lovely foliage running through to the residential areas. 3791 has a lot to offer in terms of popular parks, walking tracks, lovely gardens, arts and crafts and lovely bird-watching spots.",
Mourilyan,Queensland,Country,4858,178,1,,Mourilyan 4858 population,,"The leafy landscapes of 4858 are probably one of the first things to notice and admire while driving through the areas of Common Loop, Etty Bay, Maryville, Mourilyan, Mourilyan and New Harbourline. As the name suggests, Etty Bay coastal town hidden in Queensland's tropical north, it’s home to about 397 people, yet attracts visitors from Queensland and beyond to its exquisite rocky beaches surrounded by green foilage and adventurous walking tracks. It’s about 90 minutes to Cairns, but a lot further to the State’s capital. Still, residents still find it easy to get around to more urban areas for a wider range of amenities.",
